name,cost_text,coordinates,rooms,desc,available_date,property_type,nearest_schools
1/1 Ellesmere Road Windsor VIC 3181,$330 pw,"[-37.8570864, 144.9995459]","['1 Bed', '1 Bath', '1 Parking']",Leasing Team,Available Now,Apartment / Unit / Flat,"['0.3 km away', '0.9 km away', '3.1 km away']"
10/16 Kemp Street Thornbury VIC 3071,$295,"[-37.761921, 144.995138]","['1 Bed', '1 Bath', '1 Parking']",This first floor one bedroom apartment comprises light filled kitchen with stainless steel electric cooktop and stainless steel electric under bench oven. Light filled and spacious lounge room with electric heating. Carpeted bedroom with great sized BIR and main central tiled bathroom with shower over bath and washing machine taps for those not fond of communal laundries. If you've been looking,"Tuesday, 18th October 2022",Apartment / Unit / Flat,"['0.7 km away', '0.7 km away', '1.4 km away']"
305/83 Queens Road Melbourne VIC 3004,$450 per week,"[-37.8542601, 144.9804163]","['1 Bed', '1 Bath', '1 Parking']","Boasting a prized inner city address in a highly sought-after Queens Road secure complex, this outstanding one-bedroom apartment presents the ultimate in contemporary designer living. Elegantly appointed throughout, the surprisingly spacious open plan design is complemented by a private covered entertaining terrace and exceptional residents' facilities. A fantastic opportunity for renters, this","Wednesday, 28th September 2022",Apartment / Unit / Flat,"['1 km away', '1.4 km away', '3.1 km away']"
1810/8 Marmion Place Docklands VIC 3008,$500 per week,"[-37.8133446, 144.9425312]","['1 Bed', '1 Bath', '1 Parking']","Experience a first class inner city lifestyle in Docklands. Enjoy the convenience of living alongside the stunning harbour, restaurants, cafes, the CBD, Harbour Town and Etihad Stadium and transport right at your door step. Docklands stunning development, Harbour One is ready for you to move in!
This stunningly spacious one bedroom apartment is well set out, including a modern kitchen with stone","Friday, 7th October 2022",Apartment / Unit / Flat,['2.2 km away']
413/8 Olive York Way Brunswick West VIC 3055,$350 per week,"[-37.7590279, 144.9397616]","['1 Bed', '1 Bath', '1 Parking']","If space, light and location is what you are looking for, then you don't need to look any further!","Friday, 28th October 2022",Apartment / Unit / Flat,"['0.4 km away', '2 km away']"
4/487 Ryrie Street East Geelong VIC 3219,$260 per week,"[-38.1552339, 144.3822318]","['1 Bed', '1 Bath', '1 Parking']",Located just minutes away from the City Centre sits this one-bedroom unit! ,Available Now,Apartment / Unit / Flat,"['0.8 km away', '1.2 km away', '2.6 km away']"
803/483 Swanston Street Melbourne VIC 3000,$500 per week,"[-37.8072179, 144.9623358]","['1 Bed', '1 Bath', '− Parking']","Nestled within the popular Verve residential building, this one-bedroom apartment is offered UNFURNISHED and is perfect for students or professionals alike. ",Available Now,Apartment / Unit / Flat,"['0.9 km away', '1.3 km away']"
506/179 Boundary Road North Melbourne VIC 3051,$400 per week,"[-37.7889129, 144.9392885]","['1 Bed', '1 Bath', '1 Parking']","Furniture is not included, photo is for illustration only.
This is classic inner-city living with all the lifestyle benefits. Which your everyday life will be centre around with the open-plan and light-filled kitchen, incorporating stylish stone/stainless steel kitchen dining and living room with crisp white walls, on-trend flooring and private balcony terrace, Sleek euro laundry bathroom, split","Friday, 7th October 2022",Apartment / Unit / Flat,"['0.5 km away', '0.9 km away']"
5/42 Tranmere Avenue Carnegie VIC 3163,$330,"[-37.89099849999999, 145.0605786]","['1 Bed', '1 Bath', '1 Parking']",Leafy central location one of only 8 units.,"Saturday, 15th October 2022",Apartment / Unit / Flat,"['0.5 km away', '2.1 km away', '4 km away']"
5/2 Coles Court Beaumaris VIC 3193,$365.00,"[-37.9796782, 145.0467998]","['1 Bed', '1 Bath', '− Parking']","Perfectly positioned near the beach with a short stroll to shops, sought after schools 
and bus stop, this spacious, fully renovated, newly carpeted one bedroom unit with study nook, exudes a particularly uplifting ambiance and the promise of a truly fulfilled lifestyle. ","Friday, 7th October 2022",Apartment / Unit / Flat,"['0.6 km away', '1 km away', '1.2 km away']"
113/191 Powlett Street East Melbourne VIC 3002,$420.00,"[-37.8100943, 144.9860492]","['1 Bed', '1 Bath', '1 Parking']","Elegantly designed and tempered with industrial hallmarks, this stunning residence on the site of the former Victoria Brewery awaits. Boasting an Innovative design that maximizes space and delivers absolute quality in one of East Melbourne's desired locations.",Available Now,Apartment / Unit / Flat,"['0.9 km away', '7.7 km away']"
808/2 Joseph Road Footscray VIC 3011,$390,"[-37.80033230000001, 144.9096597]","['1 Bed', '1 Bath', '1 Parking']",Mary Mezei,"Friday, 30th September 2022",Apartment / Unit / Flat,"['1.1 km away', '1.7 km away', '1.7 km away']"
1216/39 Coventry Street Southbank VIC 3006,$395,"[-37.8294033, 144.9692407]","['1 Bed', '1 Bath', '− Parking']"," class=""css-dxogle"">* Unverified feature<svg aria-hidden=""true"" class=""domain-icon css-kry84i"" viewbox=""0 0 18 18""><circle cx=""9.5"" cy=""9.5"" fill=""none"" r=""6.5"" stroke=""currentColor"" stroke-width=""2""></circle><path d=""M9.5 11.5v-3"" fill=""none"" stroke=""currentColor""></path><circle cx=""9.5"" cy=""6.5"" fill=""currentColor"" r="".5""></circle></svg","Friday, 28th October 2022",Apartment / Unit / Flat,"['1.4 km away', '2.5 km away', '3.1 km away']"
207/79 Merton Street Altona Meadows VIC 3028,$350 per week,"[-37.8722112, 144.7777264]","['1 Bed', '1 Bath', '1 Parking']",Leasing Team,"Saturday, 8th October 2022",Apartment / Unit / Flat,"['0.4 km away', '1.8 km away']"
1028/572 St Kilda Road Melbourne VIC 3004,$325 Per Week,"[-37.8477661, 144.9786951]","['1 Bed', '1 Bath', '− Parking']","Lease this gorgeous unfurnished modern style cosy studio apartment with beautiful views
out towards the iconic St Kilda bay for an initial 12 month lease with the potential to
extend.","Tuesday, 1st November 2022",Apartment / Unit / Flat,"['0.9 km away', '1.2 km away', '3.5 km away']"
5/23 Avoca Street South Yarra VIC 3141,$300,"[-37.8375641, 144.9890015]","['1 Bed', '1 Bath', '1 Parking']","Immaculately presented fully furnished one bedroom apartment with car space, close proximity to Alfred hospital. This apartment would suit person in the medical field. ",Available Now,Apartment / Unit / Flat,"['0.5 km away', '1.6 km away', '2.5 km away']"
614/157 Lonsdale Street Dandenong VIC 3175,$330,"[-37.99044110000001, 145.2142842]","['1 Bed', '1 Bath', '1 Parking']","Harcourts Asap Rental department is proud to offer this cozy one bedroom apartment located in Dandenong central . 
This property is the ideal apartment to live in, with views out towards the bay. The lounge room presents with an open view of the kitchen. The apartment is completely carpeted. This apartment is conveniently located within walking distance to train station and on the main shopping",Available Now,Apartment / Unit / Flat,"['0.6 km away', '1.3 km away', '10.7 km away']"
7/123 Victoria Street Brunswick East VIC 3057,$275.00 per week,"[-37.767706, 144.9735178]","['1 Bed', '1 Bath', '1 Parking']","Moments to Lygon Street cafes, shops, bars, restaurants, transport and parks, this ground floor studio apartment offers the ease of minimal maintenance in a hot inner city locale. Living under 5 kms from the CBD, the open design sees a kitchen with electric hotplates, living area and sleeping quarters adjoining a two stage bathroom with closet. The neatly kept complex includes a communal laundry",Available Now,Apartment / Unit / Flat,"['0.6 km away', '1.3 km away', '1.6 km away']"
6/3 Holmes Street Brunswick East VIC 3057,$265 per week,"[-37.761468, 144.9737946]","['1 Bed', '1 Bath', '− Parking']"," class=""css-dxogle"">* Unverified feature<svg aria-hidden=""true"" class=""domain-icon css-kry84i"" viewbox=""0 0 18 18""><circle cx=""9.5"" cy=""9.5"" fill=""none"" r=""6.5"" stroke=""currentColor"" stroke-width=""2""></circle><path d=""M9.5 11.5v-3"" fill=""none"" stroke=""currentColor""></path><circle cx=""9.5"" cy=""6.5"" fill=""currentColor"" r="".5""></circle></svg","Wednesday, 1st February 2023",Apartment / Unit / Flat,"['0.6 km away', '1.2 km away', '1.9 km away']"
201/370 Johnston Street Abbotsford VIC 3067,$420.00 per week,"[-37.8000272, 144.9977812]","['1 Bed', '1 Bath', '− Parking']",Pavilion is the epitome of boutique luxury located in Melbourne's vibrant city fringe suburb of Abbotsford. This amazing 63m one bedroom residence has an abundance of natural light with spacious master bedroom including ensuite and walk in robe. Modern interiors designed by the highly acclaimed Carr Design Group are beautifully paired with architecture by CBG,"Wednesday, 19th October 2022",Apartment / Unit / Flat,['0.7 km away']
103/181 Fitzroy Street St Kilda VIC 3182,$435 per week,"[-37.8577879, 144.9811923]","['1 Bed', '1 Bath', '− Parking']","We are proud to represent this super chic 1 bedroom designer apartment in the sought after 181 Fitzroy Street building has the feel of living in a luxury hotel. Head up to the roof-top for the entertaining facilities and be awestruck with its spectacular resort quality infinity lap pool, alfresco BBQ, full kitchen and 360 degrees of uninterrupted views, including the Bay and the City! Spoil","Monday, 24th October 2022",Apartment / Unit / Flat,"['0.3 km away', '1.1 km away', '4.2 km away']"
3/1 Hatfield Court West Footscray VIC 3012,$320.00 Per Week,"[-37.8086303, 144.8687543]","['1 Bed', '1 Bath', '1 Parking']","Bright one-bedroom ground floor apartment. Renovated approx. 3 years ago with an updated kitchen and central bathroom, freshly painted and ceramic tiling throughout. Comprises open plan living and kitchen area, spacious 1 bedroom with BIR's, central bathroom and allocated car space.",Available Now,Apartment / Unit / Flat,"['0.7 km away', '3 km away', '3 km away']"
9/22 Empire Street Footscray VIC 3011,$250 per week,"[-37.7890465, 144.8918832]","['1 Bed', '1 Bath', '1 Parking']"," class=""css-dxogle"">* Unverified feature<svg aria-hidden=""true"" class=""domain-icon css-kry84i"" viewbox=""0 0 18 18""><circle cx=""9.5"" cy=""9.5"" fill=""none"" r=""6.5"" stroke=""currentColor"" stroke-width=""2""></circle><path d=""M9.5 11.5v-3"" fill=""none"" stroke=""currentColor""></path><circle cx=""9.5"" cy=""6.5"" fill=""currentColor"" r="".5""></circle></svg",Available Now,Apartment / Unit / Flat,"['0.3 km away', '0.8 km away', '1.1 km away']"
518/7 Claremont Street South Yarra VIC 3141,$400 Per Week,"[-37.83820559999999, 144.9935531]","['1 Bed', '1 Bath', '− Parking']","Spacious one-bedroom apartment in near new building. With a luxurious west facing living spilling onto full length balcony to the bedroom, this apartment is perfect for entertaining. Kitchen with stone benches, stainless steel appliances with gas cooking and integrated dishwasher, stylish wide European Oak floors throughout compliment the bright living room with reverse cycle air conditioning","Thursday, 13th October 2022",Apartment / Unit / Flat,"['1.5 km away', '1.6 km away', '2.4 km away']"
4/990-992 Heatherton Road Noble Park VIC 3174,$300,"[-37.964038, 145.162231]","['1 Bed', '1 Bath', '1 Parking']","This recently renovated one bedroom brick veneer unit is situated at the rear of the block and includes kitchen with gas cooking, lounge with laminate wood flooring, spacious bedroom and bathroom plus car space. The location is hard to beat, having the bus run directly out front and being within easy distance to Noble Park and Springvale shopping, schools and amenities.","Wednesday, 5th October 2022",Apartment / Unit / Flat,"['0.3 km away', '0.4 km away', '9.7 km away']"
1/85 Devonshire Road Sunshine VIC 3020,$270,"[-37.7853568, 144.8387695]","['1 Bed', '1 Bath', '1 Parking']","Step inside and be impressed at first glance! Internally this flat comprises of 1 good sized bedroom with built in robes, bright lounge room with beautiful floating wood floor, kitchen with adjoining meals area, bathroom with laundry facilities and an allocated car space. Features include beautiful wood floors, new reverse cycle split system and electric cooking appliances. Property is located","Friday, 7th October 2022",Apartment / Unit / Flat,"['0.7 km away', '1.1 km away', '2.8 km away']"
C221/201/209 High Street Prahran VIC 3181,$313.00 per week,"[-37.8518824, 144.9947656]","['1 Bed', '1 Bath', '1 Parking']","NRAS Applications are required. Please contact us for the application to be emailed to you. The National Rental Affordability Scheme NRAS provides affordable rental for eligible tenants whose total 2020-2021 household gross income thresholds meet the following indicative criteria Household Type and Income being equal to or less than the following: 
1 adult - $52,795
2 adults - $72,993
3 Adults","Wednesday, 26th October 2022",Apartment / Unit / Flat,"['0.3 km away', '0.6 km away', '3.5 km away']"
411/30-34 Bray Street South Yarra VIC 3141,$340 per week,"[-37.8444608, 144.9954419]","['1 Bed', '1 Bath', '− Parking']","This well presented studio apartment is situated in the heart of South Yarra, one of Melbourne best locations on the 7th floor of 'Society Development'
It offers comfortable open plan living and dining, modern well-appointed kitchen with European appliances, dishwasher and reverse cycle air conditioning/heating. modern bathroom and European style laundry and a good size balcony.
Additional","Saturday, 1st October 2022",Apartment / Unit / Flat,"['0.9 km away', '1.3 km away', '3 km away']"
209/5 Dudley Street Caulfield East VIC 3145,$295 per week,"[-37.880464, 145.0480025]","['1 Bed', '1 Bath', '− Parking']"," class=""css-dxogle"">* Unverified feature<svg aria-hidden=""true"" class=""domain-icon css-kry84i"" viewbox=""0 0 18 18""><circle cx=""9.5"" cy=""9.5"" fill=""none"" r=""6.5"" stroke=""currentColor"" stroke-width=""2""></circle><path d=""M9.5 11.5v-3"" fill=""none"" stroke=""currentColor""></path><circle cx=""9.5"" cy=""6.5"" fill=""currentColor"" r="".5""></circle></svg","Wednesday, 7th December 2022",Apartment / Unit / Flat,"['1.1 km away', '1.1 km away', '5.3 km away']"
301/5 Dudley Street Caulfield East VIC 3145,$295 per week,"[-37.880464, 145.0480025]","['1 Bed', '1 Bath', '− Parking']"," class=""css-dxogle"">* Unverified feature<svg aria-hidden=""true"" class=""domain-icon css-kry84i"" viewbox=""0 0 18 18""><circle cx=""9.5"" cy=""9.5"" fill=""none"" r=""6.5"" stroke=""currentColor"" stroke-width=""2""></circle><path d=""M9.5 11.5v-3"" fill=""none"" stroke=""currentColor""></path><circle cx=""9.5"" cy=""6.5"" fill=""currentColor"" r="".5""></circle></svg","Monday, 5th December 2022",Apartment / Unit / Flat,"['1.1 km away', '1.1 km away', '5.3 km away']"
407/386 Spencer Street West Melbourne VIC 3003,$450,"[-37.811364, 144.950875]","['1 Bed', '1 Bath', '− Parking']",Kim Te,"Friday, 21st October 2022",Apartment / Unit / Flat,"['1.4 km away', '1.6 km away']"
304/100 Hawthorn Road Caulfield North VIC 3161,$370 per week,"[-37.8729307, 145.0243247]","['1 Bed', '1 Bath', '1 Parking']"," class=""css-dxogle"">* Unverified feature<svg aria-hidden=""true"" class=""domain-icon css-kry84i"" viewbox=""0 0 18 18""><circle cx=""9.5"" cy=""9.5"" fill=""none"" r=""6.5"" stroke=""currentColor"" stroke-width=""2""></circle><path d=""M9.5 11.5v-3"" fill=""none"" stroke=""currentColor""></path><circle cx=""9.5"" cy=""6.5"" fill=""currentColor"" r="".5""></circle></svg","Monday, 17th October 2022",Apartment / Unit / Flat,"['0.3 km away', '1.9 km away', '6.8 km away']"
8/104 Gooch Street Thornbury VIC 3071,$370 per week,"[-37.7589316, 145.0076165]","['1 Bed', '1 Bath', '1 Parking']",Located in a highly sought after pocket of Thornbury beholds this fully renovated apartment. ,"Saturday, 1st October 2022",Apartment / Unit / Flat,"['0.3 km away', '1.6 km away', '1.9 km away']"
7/10 Payne Street Caulfield North VIC 3161,$325,"[-37.8780094, 145.0338135]","['1 Bed', '1 Bath', '1 Parking']","Located in quiet leafy cul-de sac this generous ground floor, ONE bedroom apartment offers an excellent floor plan. 
Entrance hall, separate large modern kitchen with meals area, spacious living area with heating, generous bedroom with BIR's and a fully renovated bathroom with laundry facilities.","Monday, 3rd October 2022",Apartment / Unit / Flat,"['0.8 km away', '0.9 km away', '6 km away']"
7/54 Tennyson Street Elwood VIC 3184,$400 Per Week,"[-37.8739709, 144.9877105]","['1 Bed', '1 Bath', '1 Parking']",Hudson Keppell,Available Now,Apartment / Unit / Flat,"['0.5 km away', '0.9 km away', '5.8 km away']"
1110/8 Marmion Place Docklands VIC 3008,$470 per week,"[-37.8133446, 144.9425312]","['1 Bed', '1 Bath', '1 Parking']","Well located in the stylish H1 complex right in the heart of the NewQuay precinct, this modern and relaxed one bedroom apartment has been lovingly maintained and is ready to be your next home! Harbour One offers fantastic facilities which include a library lounge, media room, and gym.
 Features an enviable northerly aspect
 Open living and meals zone boasts fantastic natural light
 North-facing","Tuesday, 1st November 2022",Apartment / Unit / Flat,['2.2 km away']
1/2 Greenfield Drive Clayton VIC 3168,$340,"[-37.92322, 145.1286599]","['1 Bed', '1 Bath', '1 Parking']","This ground floor 1 bedroom apartment features a study area/dining area and an open plan living/kitchen area leading out to the front courtyard for indoor/outdoor entertainment. Featuring well presented kitchen with European stainless steel appliances including dishwasher and gas cooking, main bathroom with laundry facilities and security entrance with intercom. Also features undercover car space",Available Now,Apartment / Unit / Flat,"['1 km away', '1.3 km away', '2 km away']"
1412/4 Joseph Road Footscray VIC 3011,$400 per week,"[-37.799683, 144.9097085]","['1 Bed', '1 Bath', '1 Parking']",Mary Mezei,"Friday, 14th October 2022",Apartment / Unit / Flat,"['1.1 km away', '1.7 km away', '5.3 km away']"
1/296 Inkerman St St Kilda East VIC 3183,$385 weekly,"[-37.8662594, 145.0010205]","['1 Bed', '1 Bath', '1 Parking']",Leasing Concierge,"Wednesday, 12th October 2022",Apartment / Unit / Flat,"['1 km away', '2.3 km away', '6.1 km away']"
1/7 Washington Street Toorak VIC 3142,$520.00,"[-37.8376024, 145.0066483]","['1 Bed', '1 Bath', '1 Parking']","This light-filled Art Deco apartment is perfectly located in a boutique development of only six, within one of the most highly sought after pockets of Toorak. Featuring a well-equipped kitchen with quality appliances, gas cooking and ample cupboard space, which seamlessly flows out into the spacious living and dining area with split system heating and cooling. This impressive apartment offers a",Available Now,Apartment / Unit / Flat,"['0.9 km away', '1.8 km away', '2.1 km away']"
1404/4 Joseph Road Footscray VIC 3011,$410 per week,"[-37.799683, 144.9097085]","['1 Bed', '1 Bath', '1 Parking']",Mary Mezei,"Friday, 28th October 2022",Apartment / Unit / Flat,"['1.1 km away', '1.7 km away', '5.3 km away']"
202/89 Atherton Road Oakleigh VIC 3166,$410.00 Per Week,"[-37.8991923, 145.0943323]","['1 Bed', '1 Bath', '1 Parking']","A sleek, stylish, and sophisticated offering, this executive single-room entertainer stands on the cusp of Oakleigh's entertainment district, with eateries, boutique stores, and Oakleigh station metres from your door.","Wednesday, 28th September 2022",Apartment / Unit / Flat,"['0.7 km away', '2.6 km away', '4.2 km away']"
4/22 Crimea Street St Kilda VIC 3182,$300 per week,"[-37.8591406, 144.988399]","['1 Bed', '1 Bath', '1 Parking']",Neil Scott,"Monday, 3rd October 2022",Apartment / Unit / Flat,"['0.7 km away', '0.9 km away', '4.8 km away']"
211/2A Clarence Street Malvern East VIC 3145,$350 per week,"[-37.8749482, 145.041629]","['1 Bed', '1 Bath', '− Parking']",Leasing Team,"Tuesday, 4th October 2022",Apartment / Unit / Flat,"['0.5 km away', '1.2 km away', '6 km away']"
7/74 Denbigh Road Armadale VIC 3143,$310 per week,"[-37.8555417, 145.0165058]","['1 Bed', '1 Bath', '1 Parking']","Perfectly positioned in one of Armadale's premier tree-lined streets, this updated and elevated apartment with off street parking is an opportunity not to be missed! Just a short stroll to Armadale Train Station, High Street trams and cafes, this secure apartment comprises living/dining room, generous bedroom with built in robes, central bathroom and separate kitchen. Further complemented by","Monday, 17th October 2022",Apartment / Unit / Flat,"['0.4 km away', '3.1 km away', '6.9 km away']"
505/26 Southgate Avenue Southbank VIC 3006,$550PW - Fully Furnished,"[-37.8204479, 144.9671207]","['1 Bed', '1 Bath', '− Parking']"," class=""css-dxogle"">* Unverified feature<svg aria-hidden=""true"" class=""domain-icon css-kry84i"" viewbox=""0 0 18 18""><circle cx=""9.5"" cy=""9.5"" fill=""none"" r=""6.5"" stroke=""currentColor"" stroke-width=""2""></circle><path d=""M9.5 11.5v-3"" fill=""none"" stroke=""currentColor""></path><circle cx=""9.5"" cy=""6.5"" fill=""currentColor"" r="".5""></circle></svg","Wednesday, 19th October 2022",House,"['1.5 km away', '2.8 km away', '2.9 km away']"
304/7 Thomas Holmes Street Maribyrnong VIC 3032,$350 weekly,"[-37.7836643, 144.8926529]","['1 Bed', '1 Bath', '1 Parking']","This unique apartment offers a rare and exclusive opportunity to enjoy an area rich in riverside nature, with all the convenience of a modern, inner-city lifestyle. Step out onto wetlands, jump on a bike track and ride into the city, or stroll over the pedestrian bridge for a game of golf. Offering the best of both worlds, Ariele makes an irresistible river retreat. ","Saturday, 8th October 2022",Apartment / Unit / Flat,"['0.6 km away', '0.9 km away', '3.3 km away']"
4/18 Orange Grove Balaclava VIC 3183,$325.00 per week,"[-37.8676396, 144.9965852]","['1 Bed', '1 Bath', '1 Parking']","Nestled amongst period homes on a quiet, tree lined street, this immaculate boutique block form a private retreat thats smart, stylish and just a five-minute walk from all the lifestyle attractions of Carlisle Street. Be part of the St Kilda and Carlisle Streets caf culture, with city transport. Close to a diversity of shops and eating-out venues, supermarkets, Chapel and Acland Streets and the",Available Now,Apartment / Unit / Flat,"['0.8 km away', '1.9 km away', '5.9 km away']"
2/11 Rathmines Street Fairfield VIC 3078,$330,"[-37.770582, 145.017476]","['1 Bed', '1 Bath', '1 Parking']","Indoor pet friendly, with dog parks nearby.","Monday, 24th October 2022",Apartment / Unit / Flat,"['0.9 km away', '1.7 km away', '2.7 km away']"
4/34 Royal Avenue Glen Huntly VIC 3163,$290 per week,"[-37.8952058, 145.0418228]","['1 Bed', '1 Bath', '1 Parking']","This one-bedroom apartment is an instant hit made even more exciting by its leafy neighbourhood setting just meters from EE Gunn &amp; Lord Reserves. 
Bright lounge, bedroom uilt-in-robes, an en-suite bathroom housing shower, vanity and toilet. 
Includes polished timber floors and carport parking 
Just a short walk from the shops and cafes of both Glen Huntly and Ormond Villages, trains to Caulfield","Wednesday, 5th October 2022",Apartment / Unit / Flat,"['0.4 km away', '1.1 km away', '3.9 km away']"
1506/2 Newquay Promenade Docklands VIC 3008,$400 per week,"[-37.8138395, 144.9440558]","['1 Bed', '1 Bath', '1 Parking']","Combining wonderful timber detail with sleek modern style and showing off outstanding views of the city, this generous STUDIO apartment in the coveted Conder complex. 
The relaxed main lounge/bedroom boasts fashionable wooden floors opening to undercover balcony, with a galley kitchen and meals space with stone benchtops and Miele stainless steel appliances. Central quality bathroom with Euro",Available Now,Apartment / Unit / Flat,['2.1 km away']
2615/151 City Road Southbank VIC 3006,$460 weekly,"[-37.8236674, 144.9631638]","['1 Bed', '1 Bath', '− Parking']",Open for Inspections Schedule: Every Saturday and Private Inspection upon request (please register and get the confirmation booking) ,Available Now,Apartment / Unit / Flat,"['1 km away', '2.4 km away', '3.3 km away']"
205/69 Victoria Street Fitzroy VIC 3065,$470.00,"[-37.798678, 144.9771245]","['1 Bed', '1 Bath', '1 Parking']",** BOOK INSPECTION ONLINE **,"Friday, 21st October 2022",Apartment / Unit / Flat,"['0.4 km away', '1.3 km away', '6.4 km away']"
203/45 Victoria Parade Collingwood VIC 3066,$295 per week,"[-37.808699, 144.98413]","['1 Bed', '1 Bath', '− Parking']","Ideally located near the Australian Catholic University and an easy tram ride to the Melbourne City Centre, RMIT, Melbourne University and other educational institutions.","Thursday, 2nd February 2023",Apartment / Unit / Flat,"['0.1 km away', '0.8 km away', '7.5 km away']"
401/408 Lonsdale Street Melbourne VIC 3000,$410,"[-37.8125979, 144.9604012]","['1 Bed', '1 Bath', '− Parking']",Manuel Flores,"Wednesday, 5th October 2022",Apartment / Unit / Flat,"['1.4 km away', '1.8 km away']"
1212/41 Batman West Melbourne VIC 3003,$420 per week,"[-37.8108734, 144.9518209]","['1 Bed', '1 Bath', '1 Parking']","Retaining its' heritage entrance façade, the Park West Apartment complex provides an ideal location for City Fringe living.",Available Now,Apartment / Unit / Flat,"['1.4 km away', '1.6 km away']"
